{
  "changeover": "0.1",
  "occasion_id": "occ_roxy_20260905T1900_s1",
  "revision": 1,
  "etag": "1:WXhmiL0eh9ZeJ96DRYiyr_fPlYrOHGjwFGtFM_F2uEo",
  "venue": {
    "id": "ven_roxy",
    "name": { "content_type": "text/plain", "value": "The Roxy" },
    "origin": "https://roxy.example",
    "timezone": "Pacific/Auckland",
    "locality": "Auckland"
  },
  "auditorium": { "id": "aud_roxy_1", "seating": "allocated", "name": "Cinema One", "capacity": 220 },
  "work": { "title": { "content_type": "text/plain", "value": "The Conversation" }, "year": 1974, "runtime_minutes": 113 },
  "instant": {
    "starts_at": "2026-09-05T19:00:00+12:00",
    "local_wall": "2026-09-05T19:00",
    "local_wall_offset": "+12:00",
    "sales_cutoff_at": "2026-09-05T19:15:00+12:00"
  },
  "manner": {
    "presentation_classes": ["pres:35mm-4perf", "pres:sound-optical", "pres:reserved-seating"],
    "occasion_classes": ["occ:archival-print"],
    "register_version": "2026.1",
    "accessibility": {
      "open_captions": "no", "captioning_devices": "no", "audio_description": "no",
      "assistive_listening": "yes", "wheelchair_spaces": "yes", "relaxed_environment": "no", "sensory_adjusted": "no"
    }
  },
  "availability": {
    "mode": "seat_map",
    "observed_at": "2026-09-05T09:00:00.000+12:00",
    "staleness_basis": "measured",
    "sold_out": false,
    "seats_available": 180,
    "max_staleness_ms": 30000
  },
  "price_disclosure": "published",
  "offers": [
    { "offer_id": "off_roxy_full", "band": { "content_type": "text/plain", "value": "General admission" },
      "currency": "NZD", "amount_minor": 2400,
      "price_basis": { "includes_mandatory_fees": true, "includes_tax": true } }
  ],
  "substitution": {
    "cluster": "the-conversation-akl-2026-w36",
    "policy": "strict",
    "accepts_substitute": [],
    "not_substitutable_for": [],
    "derived_from": { "policy_id": "pol_roxy_2026", "rule_ids": [], "rule_version": "2026.1" }
  },
  "server_time": "2026-09-05T09:00:00.412+12:00"
}
